{
  "fleet_id": "fleet_demo",
  "date": "2026-10-10",
  "generated_at": "2026-10-09T04:12Z",
  "simulated": true,
  "summary": {
    "riders_total": 50,
    "riders_over_budget": 8,
    "worst_rider_pct": 138.5
  },
  "riders": [
    {
      "rider_id": "r008",
      "name": "Sunil (sim #8)",
      "home_h3": "873da115affffff",
      "shift_hours": 9.6,
      "budget_ug": 806.4,
      "forecast_dose_ug": 1116.9,
      "forecast_dose_pct": 138.5,
      "actual_dose_ug": null,
      "actual_dose_pct": null,
      "over_budget": true
    },
    {
      "rider_id": "r003",
      "name": "Suresh (sim #3)",
      "home_h3": "873da18c3ffffff",
      "shift_hours": 9.5,
      "budget_ug": 798,
      "forecast_dose_ug": 1084.5,
      "forecast_dose_pct": 135.9,
      "actual_dose_ug": null,
      "actual_dose_pct": null,
      "over_budget": true
    },
    {
      "rider_id": "r004",
      "name": "Vikas (sim #4)",
      "home_h3": "873da1113ffffff",
      "shift_hours": 9,
      "budget_ug": 756,
      "forecast_dose_ug": 974.5,
      "forecast_dose_pct": 128.9,
      "actual_dose_ug": null,
      "actual_dose_pct": null,
      "over_budget": true
    },
    {
      "rider_id": "r002",
      "name": "Rohit (sim #2)",
      "home_h3": "873da115affffff",
      "shift_hours": 9.1,
      "budget_ug": 764.4,
      "forecast_dose_ug": 907.3,
      "forecast_dose_pct": 118.7,
      "actual_dose_ug": null,
      "actual_dose_pct": null,
      "over_budget": true
    },
    {
      "rider_id": "r006",
      "name": "Manoj (sim #6)",
      "home_h3": "873da1060ffffff",
      "shift_hours": 9.5,
      "budget_ug": 798,
      "forecast_dose_ug": 862.6,
      "forecast_dose_pct": 108.1,
      "actual_dose_ug": null,
      "actual_dose_pct": null,
      "over_budget": true
    },
    {
      "rider_id": "r007",
      "name": "Rahul (sim #7)",
      "home_h3": "873da1140ffffff",
      "shift_hours": 8.6,
      "budget_ug": 722.4,
      "forecast_dose_ug": 762.1,
      "forecast_dose_pct": 105.5,
      "actual_dose_ug": null,
      "actual_dose_pct": null,
      "over_budget": true
    },
    {
      "rider_id": "r001",
      "name": "Amit (sim #1)",
      "home_h3": "873da1140ffffff",
      "shift_hours": 8.1,
      "budget_ug": 680.4,
      "forecast_dose_ug": 711,
      "forecast_dose_pct": 104.5,
      "actual_dose_ug": null,
      "actual_dose_pct": null,
      "over_budget": true
    },
    {
      "rider_id": "r005",
      "name": "Deepak (sim #5)",
      "home_h3": "873da1ab1ffffff",
      "shift_hours": 8.5,
      "budget_ug": 714,
      "forecast_dose_ug": 741.8,
      "forecast_dose_pct": 103.9,
      "actual_dose_ug": null,
      "actual_dose_pct": null,
      "over_budget": true
    },
    {
      "rider_id": "r020",
      "name": "Anil (sim #20)",
      "home_h3": "873da115affffff",
      "shift_hours": 9.1,
      "budget_ug": 764.4,
      "forecast_dose_ug": 723.9,
      "forecast_dose_pct": 94.7,
      "actual_dose_ug": null,
      "actual_dose_pct": null,
      "over_budget": false
    },
    {
      "rider_id": "r014",
      "name": "Gaurav (sim #14)",
      "home_h3": "873da115affffff",
      "shift_hours": 8.8,
      "budget_ug": 739.2,
      "forecast_dose_ug": 688.9,
      "forecast_dose_pct": 93.2,
      "actual_dose_ug": null,
      "actual_dose_pct": null,
      "over_budget": false
    },
    {
      "rider_id": "r028",
      "name": "Sunil (sim #28)",
      "home_h3": "873da1113ffffff",
      "shift_hours": 8.6,
      "budget_ug": 722.4,
      "forecast_dose_ug": 665.3,
      "forecast_dose_pct": 92.1,
      "actual_dose_ug": null,
      "actual_dose_pct": null,
      "over_budget": false
    },
    {
      "rider_id": "r038",
      "name": "Sandeep (sim #38)",
      "home_h3": "873da115affffff",
      "shift_hours": 8.8,
      "budget_ug": 739.2,
      "forecast_dose_ug": 677.8,
      "forecast_dose_pct": 91.7,
      "actual_dose_ug": null,
      "actual_dose_pct": null,
      "over_budget": false
    },
    {
      "rider_id": "r029",
      "name": "Arjun (sim #29)",
      "home_h3": "873da1ab1ffffff",
      "shift_hours": 9.6,
      "budget_ug": 806.4,
      "forecast_dose_ug": 735.4,
      "forecast_dose_pct": 91.2,
      "actual_dose_ug": null,
      "actual_dose_pct": null,
      "over_budget": false
    },
    {
      "rider_id": "r025",
      "name": "Deepak (sim #25)",
      "home_h3": "873da1140ffffff",
      "shift_hours": 9.3,
      "budget_ug": 781.2,
      "forecast_dose_ug": 682.8,
      "forecast_dose_pct": 87.4,
      "actual_dose_ug": null,
      "actual_dose_pct": null,
      "over_budget": false
    },
    {
      "rider_id": "r013",
      "name": "Sahil (sim #13)",
      "home_h3": "873da1140ffffff",
      "shift_hours": 9.3,
      "budget_ug": 781.2,
      "forecast_dose_ug": 676.5,
      "forecast_dose_pct": 86.6,
      "actual_dose_ug": null,
      "actual_dose_pct": null,
      "over_budget": false
    },
    {
      "rider_id": "r032",
      "name": "Raj (sim #32)",
      "home_h3": "873da115affffff",
      "shift_hours": 9.9,
      "budget_ug": 831.6,
      "forecast_dose_ug": 718.5,
      "forecast_dose_pct": 86.4,
      "actual_dose_ug": null,
      "actual_dose_pct": null,
      "over_budget": false
    },
    {
      "rider_id": "r031",
      "name": "Nitin (sim #31)",
      "home_h3": "873da1140ffffff",
      "shift_hours": 8.3,
      "budget_ug": 697.2,
      "forecast_dose_ug": 574.5,
      "forecast_dose_pct": 82.4,
      "actual_dose_ug": null,
      "actual_dose_pct": null,
      "over_budget": false
    },
    {
      "rider_id": "r048",
      "name": "Sunil (sim #48)",
      "home_h3": "873da1060ffffff",
      "shift_hours": 8.7,
      "budget_ug": 730.8,
      "forecast_dose_ug": 591.9,
      "forecast_dose_pct": 81,
      "actual_dose_ug": null,
      "actual_dose_pct": null,
      "over_budget": false
    },
    {
      "rider_id": "r035",
      "name": "Pawan (sim #35)",
      "home_h3": "873da1ab1ffffff",
      "shift_hours": 9.5,
      "budget_ug": 798,
      "forecast_dose_ug": 616.1,
      "forecast_dose_pct": 77.2,
      "actual_dose_ug": null,
      "actual_dose_pct": null,
      "over_budget": false
    },
    {
      "rider_id": "r018",
      "name": "Sandeep (sim #18)",
      "home_h3": "873da1060ffffff",
      "shift_hours": 8.1,
      "budget_ug": 680.4,
      "forecast_dose_ug": 518.5,
      "forecast_dose_pct": 76.2,
      "actual_dose_ug": null,
      "actual_dose_pct": null,
      "over_budget": false
    },
    {
      "rider_id": "r042",
      "name": "Rohit (sim #42)",
      "home_h3": "873da1060ffffff",
      "shift_hours": 9.5,
      "budget_ug": 798,
      "forecast_dose_ug": 604.1,
      "forecast_dose_pct": 75.7,
      "actual_dose_ug": null,
      "actual_dose_pct": null,
      "over_budget": false
    },
    {
      "rider_id": "r049",
      "name": "Arjun (sim #49)",
      "home_h3": "873da1140ffffff",
      "shift_hours": 8.6,
      "budget_ug": 722.4,
      "forecast_dose_ug": 546.1,
      "forecast_dose_pct": 75.6,
      "actual_dose_ug": null,
      "actual_dose_pct": null,
      "over_budget": false
    },
    {
      "rider_id": "r043",
      "name": "Suresh (sim #43)",
      "home_h3": "873da1140ffffff",
      "shift_hours": 9.8,
      "budget_ug": 823.2,
      "forecast_dose_ug": 598.5,
      "forecast_dose_pct": 72.7,
      "actual_dose_ug": null,
      "actual_dose_pct": null,
      "over_budget": false
    },
    {
      "rider_id": "r036",
      "name": "Ajay (sim #36)",
      "home_h3": "873da1060ffffff",
      "shift_hours": 8,
      "budget_ug": 672,
      "forecast_dose_ug": 480.5,
      "forecast_dose_pct": 71.5,
      "actual_dose_ug": null,
      "actual_dose_pct": null,
      "over_budget": false
    },
    {
      "rider_id": "r037",
      "name": "Vijay (sim #37)",
      "home_h3": "873da1140ffffff",
      "shift_hours": 9.6,
      "budget_ug": 806.4,
      "forecast_dose_ug": 570.9,
      "forecast_dose_pct": 70.8,
      "actual_dose_ug": null,
      "actual_dose_pct": null,
      "over_budget": false
    },
    {
      "rider_id": "r015",
      "name": "Pawan (sim #15)",
      "home_h3": "873da18c3ffffff",
      "shift_hours": 8.8,
      "budget_ug": 739.2,
      "forecast_dose_ug": 509.3,
      "forecast_dose_pct": 68.9,
      "actual_dose_ug": null,
      "actual_dose_pct": null,
      "over_budget": false
    },
    {
      "rider_id": "r011",
      "name": "Nitin (sim #11)",
      "home_h3": "873da1ab1ffffff",
      "shift_hours": 9.8,
      "budget_ug": 823.2,
      "forecast_dose_ug": 531,
      "forecast_dose_pct": 64.5,
      "actual_dose_ug": null,
      "actual_dose_pct": null,
      "over_budget": false
    },
    {
      "rider_id": "r017",
      "name": "Vijay (sim #17)",
      "home_h3": "873da1ab1ffffff",
      "shift_hours": 8.9,
      "budget_ug": 747.6,
      "forecast_dose_ug": 480,
      "forecast_dose_pct": 64.2,
      "actual_dose_ug": null,
      "actual_dose_pct": null,
      "over_budget": false
    },
    {
      "rider_id": "r027",
      "name": "Rahul (sim #27)",
      "home_h3": "873da18c3ffffff",
      "shift_hours": 8.1,
      "budget_ug": 680.4,
      "forecast_dose_ug": 432.1,
      "forecast_dose_pct": 63.5,
      "actual_dose_ug": null,
      "actual_dose_pct": null,
      "over_budget": false
    },
    {
      "rider_id": "r034",
      "name": "Gaurav (sim #34)",
      "home_h3": "873da1113ffffff",
      "shift_hours": 9.3,
      "budget_ug": 781.2,
      "forecast_dose_ug": 492.2,
      "forecast_dose_pct": 63,
      "actual_dose_ug": null,
      "actual_dose_pct": null,
      "over_budget": false
    },
    {
      "rider_id": "r012",
      "name": "Raj (sim #12)",
      "home_h3": "873da1060ffffff",
      "shift_hours": 8.4,
      "budget_ug": 705.6,
      "forecast_dose_ug": 433.2,
      "forecast_dose_pct": 61.4,
      "actual_dose_ug": null,
      "actual_dose_pct": null,
      "over_budget": false
    },
    {
      "rider_id": "r047",
      "name": "Rahul (sim #47)",